<?xml version="1.0" encoding="UTF-8"?>
<tour kind="demo" language="bn"
      xmlns:xsi="http://www.w3.org/2001/XMLSchema-instance"
      xsi:noNamespaceSchemaLocation="../walkthrough.xsd">

  <mission id="sales">
    <title>গত মাসের বিক্রি</title>

    <step key="intro">
      <title>গত মাসে আপনার বিক্রি কত ছিল?</title>
      <body>বেশিরভাগ মালিক এই হিসাব রসিদের স্তূপ থেকে বের করেন। চলুন তিনটি ক্লিকেই করে ফেলি — আর দেখি সংখ্যাটা আসলে কী দিয়ে তৈরি।</body>
    </step>

    <step key="open-reporting">
      <title>রিপোর্টিং খুলুন</title>
      <body>মূল মেনুতে। পণ্যের সব রিপোর্ট এই একটি জায়গার পেছনেই আছে।</body>
    </step>

    <step key="range">
      <title>সময়সীমা, একবারই ঠিক করুন</title>
      <body>আপনার জন্য এটি "গত মাস" করা হয়েছে। এই পাতার প্রতিটি ট্যাব এটাই মানে, তাই একবার সময় বেছে নিয়ে তেরোটি রিপোর্টই পড়তে পারবেন।</body>
    </step>

    <step key="revenue">
      <title>এটাই পুরো মাস</title>
      <body>প্রতিটি কাউন্টার, ডেলিভারি অ্যাপ আর টিলের সব অর্ডার একসাথে যোগ করা। এটি বের করতে কিছুই টাইপ করতে হয়নি।</body>
    </step>

    <step key="collected">
      <title>বিক্রি আর আদায় এক নয়</title>
      <body>এটি সেই টাকা যা সত্যিই হাতে এসেছে। দুই ঘরের পার্থক্যই আপনার বকেয়া — যা বেশিরভাগ রেস্টুরেন্ট কখনো দেখতেই পায় না।</body>
    </step>

    <step key="trend">
      <title>আর কোন দিনগুলো কাজ করেছে</title>
      <body>একই মাস, দিন ধরে ধরে। কোন রাতে বেশি লোক রাখবেন আর কোন রাতে তাড়াতাড়ি বন্ধ করবেন — এই চার্টই বলে দেয়।</body>
    </step>

    <step key="done">
      <title>আপনি এক মাসের ব্যবসা পড়ে ফেললেন</title>
      <body>বিক্রি, আদায়, বকেয়া আর মাসের গতিপ্রকৃতি। এরপর: এর মধ্যে লাভ কতটুকু।</body>
    </step>
  </mission>

  <mission id="profit">
    <title>লাভ না লোকসান</title>

    <step key="intro">
      <title>বিক্রি মানেই লাভ নয়</title>
      <body>ব্যস্ত মাসেও লোকসান হতে পারে, আর হিসাবরক্ষক তা বলতে তিন সপ্তাহ নেন। এখানে সেটা এক ট্যাব দূরে।</body>
    </step>

    <step key="open-tab">
      <title>প্রফিট-এ ক্লিক করুন</title>
      <body>উপরের ট্যাবগুলোর সারিতে। আপনার বেছে নেওয়া সময়সীমা বহাল থাকে, তাই এটিও গত মাসেরই হিসাব।</body>
    </step>

    <step key="income">
      <title>যা কিছু এসেছে</title>
      <body>পরিশোধিত অর্ডার, সঙ্গে হাতে লেখা যেকোনো আয় — ক্যাটারিং, হল ভাড়া। দুটোই ধরা হয়, তাই মোটটাই আসল।</body>
    </step>

    <step key="expenses">
      <title>যা কিছু বেরিয়ে গেছে</title>
      <body>আপনার ক্রয় আদেশ আর লেখা পরিচালন খরচ একসাথে। মিশন ৫ ও ৬-এই এই দুটি সংখ্যা তৈরি হয়।</body>
    </step>

    <step key="net">
      <title>শেষে যা থাকল</title>
      <body>একটাই সংখ্যা — মাসটা দরজা খোলার মতো ছিল কি না, সেটা এটাই ঠিক করে।</body>
    </step>

    <step key="breakdown">
      <title>আর কোথায় গেল</title>
      <body>লাইন ধরে ধরে, যাতে খারাপ মাসের কারণ নিজেই বলে দেয় — অনুমান করতে না হয়।</body>
    </step>

    <step key="done">
      <title>গত মাসে লাভ হয়েছে কি না, এখন জানেন</title>
      <body>আয়, ব্যয় আর অবশিষ্ট। এরপর: আপনার গুদাম হিসাবের সঙ্গে মেলে কি না।</body>
    </step>
  </mission>

  <mission id="stock">
    <title>স্টকের অবস্থা</title>

    <step key="intro">
      <title>এই মুহূর্তে গুদামে কী আছে?</title>
      <body>সার্ভিসের মাঝখানে মাল ফুরালে টেবিলও যায়, সুনামও যায়। এই স্ক্রিন ঘটার আগের দিনই জানিয়ে দেয়।</body>
    </step>

    <step key="open-tab">
      <title>ইনভেন্টরি হেলথ-এ ক্লিক করুন</title>
      <body>একই ট্যাবের সারিতে। এটি ইচ্ছে করেই তারিখ ফিল্টার মানে না — স্টক মানে এখন কী আছে, আগে কী ছিল তা নয়।</body>
    </step>

    <step key="low">
      <title>আজ যে সংখ্যাটির দিকে তাকাতেই হবে</title>
      <body>আপনার ঠিক করা রি-অর্ডার সীমায় বা তার নিচে থাকা পণ্য। শূন্য না হলে কারও সরবরাহকারীকে ফোন করা উচিত।</body>
    </step>

    <step key="value">
      <title>তাকের উপর পড়ে থাকা টাকা</title>
      <body>স্টক মানে আগেই খরচ করা নগদ। সংখ্যাটি জানলেই যা টেকে তা বেশি কেনা আর যা বিক্রি হয় তা কম কেনা বন্ধ হয়।</body>
    </step>

    <step key="table">
      <title>কম স্টক সবসময় আগে</title>
      <body>তালিকা নিজেই সাজায় যাতে সমস্যা উপরে থাকে। A4 বা টিল রোলে ছেপে যিনি কেনাকাটা করেন তাঁকে দিতে পারেন।</body>
    </step>

    <step key="done">
      <title>গুদামে না গিয়েই গুদামের খবর</title>
      <body>পড়ার পর্ব শেষ। এবার কাজের পর্ব — শুরু কাউন্টার থেকে।</body>
    </step>
  </mission>

  <mission id="sale">
    <title>শুরু থেকে শেষ পর্যন্ত একটি বিক্রি</title>

    <step key="intro">
      <title>একটি অর্ডার নিন, আর তার টাকা বুঝে নিন</title>
      <body>পুরো চক্রটি: কাউন্টারে অর্ডার নেওয়া, অর্ডার বোর্ডে সেটি দেখা, সার্ভ করা হয়েছে বলে চিহ্নিত করা, আর টাকা আদায়। এতক্ষণ যা পড়লেন, সবই এখান থেকেই তৈরি।</body>
    </step>

    <step key="open-pos">
      <title>পিওএস খুলুন</title>
      <body>সারাদিন আপনার কাউন্টারের কর্মীরা এই স্ক্রিনেই থাকেন।</body>
    </step>

    <step key="pick-item">
      <title>যেকোনো খাবারে চাপ দিন</title>
      <body>এক চাপেই যোগ হয়। আরেকটি লাগলে আবার চাপুন — আলাদা করে সংখ্যা লেখার ঘর নেই, কারণ সন্ধ্যা সাতটার কাউন্টারে সে সময় থাকে না।</body>
    </step>

    <step key="cart">
      <title>বিল নিজেই তৈরি হচ্ছে</title>
      <body>পরিমাণ, রান্নাঘরের জন্য নোট, এক লাইনে বা পুরো বিলে ছাড় — সঙ্গে সঙ্গে কর আর মোট হিসাব বসে যায়।</body>
    </step>

    <step key="place">
      <title>অর্ডার দিন</title>
      <body>একই মুহূর্তে এটি রান্নাঘরের স্ক্রিন আর অর্ডার বোর্ডে চলে যায়। ডেমো রেস্টুরেন্টে এটি সত্যিকারের অর্ডার — নির্দ্বিধায় দিন।</body>
    </step>

    <step key="open-orders">
      <title>আর এই যে, বোর্ডে চলে এসেছে</title>
      <body>বিল দেওয়ার সঙ্গে সঙ্গেই এখানে চলে এসেছেন। ডাইন-ইন, টেকঅ্যাওয়ে আর ডেলিভারি — সব এই এক তালিকায়, আসার ক্রম অনুযায়ী। পরে ফিরে আসতে মূল মেনুর "Orders"।</body>
    </step>

    <step key="badges">
      <title>দুটি ব্যাজ, দুটি প্রশ্ন</title>
      <body>প্রতিটি অর্ডার বলে খাবার কোন পর্যায়ে আর টাকা এসেছে কি না। দুটো আলাদাভাবে চলে, কারণ বাস্তব রেস্টুরেন্টেও তাই হয়।</body>
    </step>

    <step key="serve">
      <title>খাবারটি এগিয়ে দিন</title>
      <body>চিহ্নিত অর্ডারের সবুজ বোতামে চাপ দিয়ে পরের ধাপে নিন — রান্না হচ্ছে, প্রস্তুত, সার্ভ করা হয়েছে। রান্নাঘরের স্ক্রিনও সঙ্গে সঙ্গে বদলায়।</body>
    </step>

    <step key="pay">
      <title>টাকা আদায় করুন</title>
      <body>ওই অর্ডারেই "Pay" বোতামে চাপ দিন।</body>
    </step>

    <step key="payment">
      <title>টাকা কীভাবে এল</title>
      <body>নগদ, কার্ড বা বিকাশ, সঙ্গে ট্রানজেকশন আইডি লেখার জায়গা। কিংবা বাকিতে ছাড়ুন — অর্ডারটি বকেয়া হিসেবে খোলা থাকে, আর সেই বকেয়াই বিক্রির রিপোর্টে ফাঁক হয়ে দেখা দেয়। টাকা নিন বা বাক্সটি বন্ধ করুন — দুভাবেই গাইড এগিয়ে যাবে।</body>
    </step>

    <step key="done">
      <title>একটি বিক্রি, শুরু থেকে শেষ</title>
      <body>নেওয়া, রান্না, সার্ভ, পরিশোধ — আর শুরুতে যে বিক্রি ও লাভের হিসাব দেখেছিলেন, তা এর মধ্যেই বদলে গেছে।</body>
    </step>
  </mission>

  <mission id="purchase">
    <title>মাল কিনে আনা</title>

    <step key="intro">
      <title>লাভের অর্ধেকটাই কেনাকাটা</title>
      <body>একটি ক্রয় আদেশ একসাথে তিনটি কাজ করে: সরবরাহকারীকে চাহিদা জানায়, মাল এলে স্টকে তোলে, আর খরচটি হিসাবে বসায়। চলুন একটি তৈরি করি।</body>
    </step>

    <step key="open-inventory">
      <title>ইনভেন্টরি খুলুন</title>
      <body>পণ্য, সরবরাহকারী, রেসিপি, অপচয় আর ক্রয় আদেশ — সবই এর পেছনে।</body>
    </step>

    <step key="open-po">
      <title>ক্রয় আদেশে যান</title>
      <body>এই পাতায় ক্রয় আদেশের কার্ডটি।</body>
    </step>

    <step key="create">
      <title>নতুন একটি আদেশ শুরু করুন</title>
      <body>উপরে ডানদিকে "Create PO"।</body>
    </step>

    <step key="supplier">
      <title>কার কাছ থেকে কিনছেন</title>
      <body>সরবরাহকারী নাম বা যোগাযোগ দিয়ে খুঁজে নেওয়া যায়। প্রতিটি আদেশ একটি ইতিহাস গড়ে, যা দিয়ে তাঁদের জবাবদিহি করাতে পারবেন।</body>
    </step>

    <step key="lines">
      <title>কী কিনছেন</title>
      <body>পণ্য, পরিমাণ আর একক দাম দিন, প্রয়োজনমতো লাইন যোগ করুন। টাইপ করার সঙ্গে সঙ্গেই মোট হিসাব বসে যায় — আর মাল বুঝে নেওয়ার সময় প্রতিটি লাইন স্টকে উঠে যায়।</body>
    </step>

    <step key="done">
      <title>কেনাকাটা এখন আপনার নিয়ন্ত্রণে</title>
      <body>অর্ডার, বুঝে নেওয়া, স্টকে তোলা আর খরচ বসানো — কাউকে দুবার লিখতে হয়নি। এরপর: যে খরচগুলো ট্রাকে করে আসে না।</body>
    </step>
  </mission>

  <mission id="books">
    <title>আয় ও ব্যয়</title>

    <step key="intro">
      <title>ভাড়া, গ্যাস, বেতন — আর টুকিটাকি আয়</title>
      <body>সব টাকা কাউন্টার দিয়ে যায় না। বাকিটা এখানে লিখলে দ্বিতীয় মিশনে দেখা লাভের হিসাব আন্দাজ না থেকে সত্যি হয়ে ওঠে।</body>
    </step>

    <step key="open-accounting">
      <title>অ্যাকাউন্টিং খুলুন</title>
      <body>লেজার, আয়, ব্যয়, করের নিয়ম আর হেডার।</body>
    </step>

    <step key="open-expenses">
      <title>ব্যয়ে যান</title>
      <body>এই পাতার ব্যয়ের কার্ডটি।</body>
    </step>

    <step key="log-expense">
      <title>একটি খরচ লিখুন</title>
      <body>উপরে ডানদিকে "Log Expense"। যেকোনো কিছু দিয়ে চেষ্টা করুন — গ্যাস বিল, মেরামত।</body>
    </step>

    <step key="expense-form">
      <title>হেডার, ধরন, পরিমাণ</title>
      <body>হেডার দিয়ে হিসাবরক্ষক শ্রেণিভুক্ত করেন; ধরন আপনার নিজের নাম। সংরক্ষণ করলেই সঙ্গে সঙ্গে লাভের রিপোর্টে চলে যায়।</body>
    </step>

    <step key="income">
      <title>আয়ও ঠিক একইভাবে চলে</title>
      <body>এটি আয়ের স্ক্রিন, ফর্মও একই। কাউন্টারের বাইরের যেকোনো আয় — ক্যাটারিং, হল ভাড়া — এখানেই লিখুন, তাহলেই মাসের হিসাবে ধরা পড়বে।</body>
    </step>

    <step key="done">
      <title>আপনার হিসাব এখন রেস্টুরেন্টের সঙ্গে মেলে</title>
      <body>কাউন্টারের বিক্রি, সরবরাহকারীর কেনাকাটা, আর বাকিটা হাতে লেখা। শেষ একটি বিষয় বাকি — আর সেটাই মনে রাখার মতো।</body>
    </step>
  </mission>

  <mission id="again">
    <title>এই গাইডে ফিরে আসা</title>

    <step key="intro">
      <title>যেকোনো সময় আবার শুরু করতে পারবেন</title>
      <body>যখন খুশি বন্ধ করে নিজে ঘুরে দেখুন — গাইড আপনার জায়গা মনে রাখবে। কোথায় পাবেন, সেটাই দেখাচ্ছি।</body>
    </step>

    <step key="open-profile">
      <title>মাই প্রোফাইল খুলুন</title>
      <body>মূল মেনুর একদম নিচে।</body>
    </step>

    <step key="card">
      <title>আপনার প্রোফাইলের এই কার্ডটি</title>